,article_id,event,slant,title,body,url,source
1027,be8504f0c24494fb3a873bc8d7219c1b,prop 50,center,More than 6 in 10 plan to vote for California redistricting plan: Survey,REDACTED,https://thehill.com/homenews/campaign/5570623-california-voters-support-redistricting-poll/,thehill
1028,0a305af2d18b56611af8d746a9ca0697,prop 50,center,California seems poised to deliver redistricting win for Newsom,REDACTED,https://thehill.com/homenews/state-watch/5577666-california-voters-democrat-map/,thehill
1029,95e962145a3191660ffac5b17a4c35a6,prop 50,center,"On Election Day in California, voters weigh in on Proposition 50",REDACTED,https://san.com/cc/on-election-day-in-california-voters-weigh-in-on-proposition-50/,straight arrow news
1030,ef15f17da1e51bcc8483d3544170237a,prop 50,center,California governor unveils voting lines plan to counter Texas Republicans,REDACTED,https://www.bbc.com/news/articles/cr4e33w6446o,bbc
1031,d8f26074283e5024131f0903f6216993,prop 50,center,California voters pass Newsom’s redistricting effort Proposition 50,REDACTED,https://www.newsnationnow.com/politics/california-prop-50-redistricting-election-result/,newsnationnow
1032,873523488271f87b5574513610dbe86a,prop 50,center,"Sabato’s Crystal Ball shifts 11 California races toward Democrats, 1 toward GOP",REDACTED,https://thehill.com/homenews/campaign/5591093-crystal-ball-california-race-shifts/,thehill
1033,0f6ac5a33f855c6943a6ce40e1ab594c,prop 50,center,Trump threatens legal action against mail voting in California redistricting election,REDACTED,https://thehill.com/homenews/campaign/5588384-trump-threatens-legal-action-california-redistricting/,thehill
1034,72abacf427c448779b49e53dac812e17,prop 50,center,Fight over new US House districts in California could turn on advertising edge in closing days,REDACTED,https://www.newsnationnow.com/politics/ap-politics/ap-fight-over-new-us-house-districts-in-california-could-turn-on-advertising-edge-in-closing-days/,newsnationnow
1035,d2f1f16d04910ca96115efbaf5cbf77e,prop 50,center,Gavin Newsom’s Gerrymandering Measure Is Likely to Fail,REDACTED,https://www.wsj.com/opinion/gavin-newsoms-gerrymandering-measure-is-likely-to-fail-77116052,wsj
1036,2058b72a66c03b6ea0234403c2cd1f7a,prop 50,center,Polls open in US elections - here are five things to watch,REDACTED,https://www.bbc.com/news/articles/c0qp5yjd253o,bbc
1037,d0fd4ce1cd98041f6b77ea18e0f90ce0,prop 50,center,Live results: California voters decide on Newsom-backed Proposition 50,REDACTED,https://thehill.com/homenews/campaign/5587000-prop-50-impact-on-midterms/,thehill
1038,1b8303243a1844e3d83b7bba81e9d728,prop 50,center,California passes Prop. 50 redistricting measure in victory for Newsom,REDACTED,https://thehill.com/homenews/campaign/5588292-california-democrats-redistricting-victory/,thehill
1039,b69502f4d74d31054a92ae8600c65015,prop 50,center,More than half of California voters back Newsom redistricting plan: Poll,REDACTED,https://thehill.com/homenews/campaign/5508953-newsom-redistricting-california-poll/,thehill
1040,b0afb20e4d8720cf412023eb98d370ca,prop 50,center,Eight California Counties Won by Donald Trump Vote ‘Yes’ on Prop 50,REDACTED,https://www.newsweek.com/california-counties-trump-vote-prop-50-map-10995552,newsweek
1041,aa7afdf18e0190a44acf3be09fc2ac00,prop 50,center,Tom Steyer donates $12M to back Calif. ballot initiative. Will he run for governor?,REDACTED,https://san.com/cc/tom-steyer-donates-12m-to-back-calif-ballot-initiative-will-he-run-for-governor/,straight arrow news
1042,24a5981434dcb448c673ebe9626df137,prop 50,center,AP Decision Notes: What to expect in California’s special election,REDACTED,https://www.newsnationnow.com/politics/ap-politics/ap-ap-decision-notes-what-to-expect-in-californias-special-election/,newsnationnow
1043,fb3aca3f482be26305cfe7c012d5f80d,prop 50,center,Newsom’s Prop 50 Redistricting Measure Faces New Lawsuit from DOJ,REDACTED,https://www.newsweek.com/newsom-prop-50-california-doj-lawsuit-trump-congress-redistricting-11043732,newsweek
1044,d28b6c2f89f2cd3d15610792ffa0b825,prop 50,center,Justice Department sues to block California US House map in clash that could tip control of Congress,REDACTED,https://www.newsnationnow.com/us-news/west/ap-justice-department-sues-to-block-california-us-house-map-in-clash-that-could-tip-control-of-congress/,newsnationnow
1045,de0b2e8fc3ba45ab9e4e90e8f0ff07d8,prop 50,center,Proposition 50 Update as Voting ‘Close to Recall Election’ Levels,REDACTED,https://www.newsweek.com/proposition-50-update-as-voting-close-to-recall-election-levels-10888744,newsweek
1046,c555f331353fc29a56aa444016a66e1f,prop 50,center,US Supreme Court allows pro-Democratic California voting map,REDACTED,https://www.reuters.com/world/us-supreme-court-allows-pro-democratic-california-voting-map-2026-02-04/,reuters
1047,d110f6c07a690b14fc449ed14f16888e,prop 50,center,California Republicans announce second legal challenge against Newsom’s redistricting effort,REDACTED,https://thehill.com/homenews/state-watch/5469479-gop-lawsuit-california-redistricting/,thehill
1048,5a634c8dbd3c1b01675f49a865e12edf,prop 50,center,Republicans ask US Supreme Court to block California voting map,REDACTED,https://www.reuters.com/legal/government/republicans-ask-us-supreme-court-block-california-voting-map-2026-01-20/,reuters
1049,7041eb88a58a3e8eae43f5d277db6b38,prop 50,center,5 things to watch in Tuesday’s biggest Election Day contests,REDACTED,https://thehill.com/homenews/campaign/5587183-governor-races-new-jersey-virginia/,thehill
1050,5c49f6d27bb61b359ad413843ffbf28a,prop 50,center,High Court Strikes Down DOMA but Leaves Fate of Proposition 8 Uncertain,REDACTED,https://www.pewresearch.org/religion/2013/06/26/high-court-strikes-down-doma-but-leaves-fate-of-prop-8-uncertain/,pewresearch
1051,c268729411615d9ee0d5b4e285307334,prop 50,center,Gavin Newsom’s Proposition 50 Passes in Blow to Donald Trump,REDACTED,https://www.newsweek.com/california-proposition-50-vote-results-redistricting-10985025,newsweek
1052,416ce60d4f76d466683787e8739a4acd,prop 50,center,US justice department sues California over new voting maps favouring Democrats,REDACTED,https://www.bbc.com/news/articles/cvgwlze7ex2o,bbc
1053,dd20104735dae3025b355b7ac38ae53e,prop 50,center,Newsom to Prop 50 redistricting supporters: Stop sending us money,REDACTED,https://san.com/cc/newsom-to-prop-50-redistricting-supporters-stop-sending-us-money/,straight arrow news
1054,ccc27196e437551d2b61186f0c49e909,prop 50,center,California Supreme Court pauses sheriff’s Prop 50 voter-fraud probe,REDACTED,https://san.com/cc/california-supreme-court-pauses-sheriffs-prop-50-voter-fraud-probe/,straight arrow news
1055,35c7560708d1439b71f4b7a8006d341d,prop 50,center,Schwarzenegger steps back into political arena in redistricting crusade,REDACTED,https://thehill.com/homenews/campaign/5477832-schwarzenegger-steps-back-into-political-arena-in-redistricting-crusade/,thehill
1056,faaede96391e7100871ea969a3e4d981,prop 50,center,California’s redistricting initiative is the 10th most expensive in state history,REDACTED,https://www.deseret.com/u-s-world/2025/10/03/california-redistricting-cost-ballotpedia/,deseret
1057,dd8afce16a96051687ee7dac68114421,prop 50,center,California voters approve redistricting. Will it tip the balance of power in Washington?,REDACTED,https://www.bbc.com/news/articles/c1lqr30l246o,bbc
1058,054f68bfd6d26ed623126a206c579b77,prop 50,left,Where to vote in California’s 2025 special election: Find a vote center or drop box,REDACTED,https://www.latimes.com/california/story/2025-10-01/where-to-vote-in-californias-2025-special-election-ballot-boxes-guide-redistricting,latimes
1059,480034f1f8bfd30571f718de9d0287b5,prop 50,left,California Republicans ready to play Trump card over Prop 50,REDACTED,https://archive.is/20251020202012/https://www.politico.com/news/2025/10/20/california-republicans-trump-prop-50-00615544,politico
1060,57e0acd1f2cf368f46507c5c96f70708,prop 50,left,DOJ sues to block California map that could tip control of Congress to Dems,REDACTED,https://www.pbs.org/newshour/politics/doj-sues-to-block-california-map-that-could-tip-control-of-congress-to-dems,pbs
1061,2dc0c434f42ecca8296faf674e627852,prop 50,left,Around 100 Proposition 50 ballots discovered at Sacramento-area homeless camp,REDACTED,https://www.cbsnews.com/sacramento/news/proposition-50-ballots-discovered-sacramento-homeless-camp/,cbsnews
1062,667922256314807cfc19b694e0286845,prop 50,left,California Approves New House Maps in a Major Win for Democrats and Newsom,REDACTED,https://www.nytimes.com/2025/11/04/us/politics/california-election-prop-50.html,nytimes
1063,41d6a5482da762a343ecc7625cef8c30,prop 50,left,"The California redistricting measure cites Texas, highlighting the partisan stakes",REDACTED,https://www.npr.org/2025/09/13/nx-s1-5527103/california-redistricting-ballot-measure-language-texas,npr
1064,4fc3c83965bce70f7064e19c08fba5fe,prop 50,left,Voter turnout exceeds expectations in California’s Prop. 50 special election,REDACTED,https://www.latimes.com/california/story/2025-10-22/voter-turnout-exceeds-expectations-in-proposition-50-special-election,latimes
1065,871cc973be3dbacfdefaa937d34de320,prop 50,left,Obama: California’s Prop 50 Is “Critical” for Democracy,REDACTED,https://www.motherjones.com/politics/2025/10/obama-california-newsom-proposition-50-redistricting/,motherjones
1066,eba01cd8481e3c0a65499bfac1fd6b69,prop 50,left,The Unbelievably Expensive Battle for California’s Congressional Map,REDACTED,https://www.motherjones.com/politics/2025/10/newsom-proposition-50-california-house-redistricting/,motherjones
1067,f71971570eca9f48917db231e3a450a0,prop 50,left,"California voters pass Prop 50 to redraw the state's congressional maps, CBS News projects",REDACTED,https://www.cbsnews.com/sacramento/news/california-prop-50-results-2025/,cbsnews
1068,4888116c5aa6199e966c997c792e1705,prop 50,left,The unlikely superstars of Prop 50,REDACTED,https://www.politico.com/newsletters/california-playbook-pm/2025/09/08/why-california-politicians-are-the-faces-of-gerrymandering-00551309,politico
1069,f552831ec68817f19ddd8a08db98e3db,prop 50,left,Over $100M spent on ads for and against California's redistricting ballot measure,REDACTED,https://www.npr.org/2025/10/08/nx-s1-5560946/over-100m-spent-on-ads-for-and-against-californias-redistricting-ballot-measure,npr
1070,4532b101a614e3e879182abd0e8e2d8b,prop 50,left,Everything you need to know about California Democrats' redistricting measure,REDACTED,https://www.politico.com/news/2025/11/04/what-you-need-to-know-california-redistricting-measure-00633471,politico
1071,d7eef2a98b0a5bd311c38e8cfff44bb5,prop 50,left,"‘Democracy is on the ballot,’ Obama says, urging Californians to pass Prop. 50 in new ad",REDACTED,https://www.latimes.com/california/story/2025-10-14/ad-former-president-obama-proposition-50-democracy,latimes
1072,9aa6e491d84ccaeec6b1cb1c4f9f4b5f,prop 50,left,California election results,REDACTED,https://apps.npr.org/2025-election-results/california.html?section=I,npr
1073,55adca48de3e2df9cd3880e77fe32918,prop 50,left,"CBS News poll finds California Prop 50 support motivated by national focus, opposition to Trump",REDACTED,https://www.cbsnews.com/news/cbs-news-poll-california-prop-50-redistricting-trump/,cbsnews
1074,04e6bba17745f7480de8044b34e98238,prop 50,left,This whole referendum in California is kind of complicated. Here’s what residents are voting on,REDACTED,https://www.cnn.com/2025/11/04/politics/california-prop-50-explained,cnn
1075,dc253f3a95d10dd30eef46ab0ab56d52,prop 50,left,The NorCal Ballot Box Podcast,REDACTED,https://www.npr.org/podcasts/1235358202/the-nor-cal-ballot-box-podcast,npr
1076,9eaf1241af8b56d7b1c2a678d9fd9b6a,prop 50,left,California Proposition 50 Election Results: Congressional Redistricting,REDACTED,https://www.nytimes.com/interactive/2025/11/04/us/elections/results-california-proposition-50-congressional-redistricting.html,nytimes
1077,8d7a28d955dfd817e8856698fc3a05ce,prop 50,left,California gears up for Proposition 50 special election. Here's when ballots mail out.,REDACTED,https://www.cbsnews.com/sacramento/news/california-proposition-50-special-election-ballots-mailed-out/,cbsnews
1078,88bd6d4e9c0d98c981aa91dd7dd3863e,prop 50,left,"Who is spending money on Prop. 50, the redistricting measure on California’s November ballot",REDACTED,https://www.latimes.com/politics/story/2025-10-07/who-is-spending-money-on-prop-50-the-redistricting-measure-on-californias-november-ballot,latimes
1079,5a5a31896b719b07dd54bb980a471354,prop 50,left,It started with a bad internal poll. How Newsom turned it around and beat Trump on redistricting,REDACTED,https://www.politico.com/news/2025/11/05/prop50-newsom-strategy-00630313,politico
1080,119e900dcbd482415bdb753014651f0c,prop 50,left,California Prop 50 results 2025,REDACTED,https://www.washingtonpost.com/elections/results/2025/11/04/california-prop-50-results/,washingtonpost
1081,9193b4332f01d8002c9fdd9578031872,prop 50,left,How ‘screw Trump’ messaging may help California’s Proposition 50 prevail,REDACTED,https://www.theguardian.com/us-news/2025/oct/25/california-prop-50-trump-redistricting,theguardian
1082,c293d39e7549b5ca93eeac51c932d45b,prop 50,left,What's on the ballot in the first general election of Trump's 2nd term,REDACTED,https://www.pbs.org/newshour/politics/whats-on-the-ballot-in-the-first-general-election-of-trumps-2nd-term,pbs
1083,8db48d76fee128406374a4fb44a51f65,prop 50,left,"Trump, contradicting the California GOP, opposes early and mail-in voting in Prop. 50 election",REDACTED,https://www.latimes.com/california/story/2025-10-27/trump-contradicts-california-gop-opposes-early-and-mail-in-voting-prop-50,latimes
1084,92572a23f9e51fbbede4c163b19c5e12,prop 50,left,"Voters in poll side with Newsom, Democrats on Prop. 50 — a potential blow to Trump and GOP",REDACTED,https://www.latimes.com/california/story/2025-10-30/poll-proposition-50,latimes
1085,c756a006056b345dd99e65d1697c79cb,prop 50,left,Live Results: California 2025 election on Proposition 50,REDACTED,https://www.pbs.org/newshour/politics/live-results-california-2025-election-on-proposition-50,pbs
1086,682f7acc3091e8d4dd324d453582cc84,prop 50,left,California poised to approve Prop 50 as voters signal displeasure with Trump,REDACTED,https://www.theguardian.com/us-news/2025/nov/02/california-prop-50-democrats-trump,theguardian
1087,512bb4bf49119245f1670a16a4092444,prop 50,left,What to Know About the Special Election in California,REDACTED,https://www.nytimes.com/2025/11/04/us/elections/california-prop-50-election-day.html,nytimes
1088,07c984b3347e3347eba64006f3f4dc7f,prop 50,left,Poll: Most Californians say they’ll vote yes on Proposition 50,REDACTED,https://www.politico.com/news/2025/10/29/poll-most-californians-vote-yes-proposition-50-00625982,politico
1089,d3597a1032b010abd179778f7963edef,prop 50,left,The incredible shrinking Republican campaign against Prop 50,REDACTED,https://www.politico.com/newsletters/california-playbook-pm/2025/09/29/the-incredible-shrinking-republican-campaign-against-prop-50-00585589,politico
1090,01d104087f9f551028d68c231f23f799,prop 50,left,Republican sheriff halts inquiry into alleged fraud in California Prop 50 vote,REDACTED,https://www.theguardian.com/us-news/2026/mar/30/california-republican-sheriff-halts-inquiry-prop-50-election,theguardian
1091,ffe659814a7ce12202ca10fefc7d70a0,prop 50,left,"California sheriff running for governor seizes over 650,000 ballots from 2025 election",REDACTED,https://www.theguardian.com/us-news/2026/mar/23/california-sheriff-election-ballots-seized,theguardian
1092,e7e17ffa97e4a36e206a1931bbca683f,prop 50,left,California voters approve Democratic-drawn congressional map as national redistricting battle spreads,REDACTED,https://www.nbcnews.com/politics/elections/california-ballot-measure-election-act-redistricting-pass-rcna238907,nbcnews
1093,3a989d8f71f123fe91864501c06a5e58,prop 50,left,What to Know About the California Special Election,REDACTED,https://www.nytimes.com/2025/10/16/us/california-election-redistricting-newsom.html,nytimes
1094,122be84f5b73a07bd8821de3f5ba6170,prop 50,left,California Ballot Measures Special Results 2025,REDACTED,https://www.nbcnews.com/politics/2025-special-elections/california-ballot-measures,nbcnews
1095,35189a8b68c7393368ee34b3ff169f1f,prop 50,left,California Republicans vow to continue fighting Prop 50,REDACTED,https://www.politico.com/news/2025/11/05/california-republicans-fighting-prop-50-00639097,politico
1096,7d2b6fcc203873419c6136fe9de4043a,prop 50,left,"In California, a Republican Sheriff Seizes Ballots, Prompting Criticism",REDACTED,https://www.nytimes.com/2026/03/23/us/politics/california-ballot-seizure-elections.html,nytimes
1097,a83efa4b098932432f57e546344709c2,prop 50,left,California Republicans thought they could beat Newsom’s gerrymander. They crashed and burned.,REDACTED,https://www.politico.com/news/2025/11/05/no-tick-tock-hed-00631875,politico
1098,fc87f803ad9ef03b8627d3c465c7aee7,prop 50,left,Democratic voters say California's Prop 50 gives them a way to 'counteract' Trump,REDACTED,https://www.npr.org/2025/11/03/g-s1-96207/california-redistricting-prop-50-trump,npr
1099,a04632e333bec371827c6ed779b19076,prop 50,left,Prop 50: appeals court rejects Republican bid to block California maps,REDACTED,https://www.theguardian.com/us-news/2026/jan/14/prop-50-california-congressional-maps-lawsuit,theguardian
1100,72055c7b8798807d3a35e87237c87cde,prop 50,left,Your last-minute guide to Proposition 50: California redistricting,REDACTED,https://archive.is/20251101151529/https://www.latimes.com/california/story/2025-11-01/la-me-last-minute-guide-prop-50,latimes
1101,3b9990edbc8090f907daa026c211c261,prop 50,left,Sacramento County ballot envelope holes draw concerns ahead of Proposition 50 special election,REDACTED,https://www.cbsnews.com/sacramento/news/sacramento-county-ballot-envelope-holes-concerns-prop-50-election/,cbsnews
1102,5afb573bfe402f10c601e88cd4ee9c9f,prop 50,left,"California voters OK new congressional lines, boosting Democrats ahead of midterms",REDACTED,https://www.npr.org/2025/11/04/nx-s1-5587742/election-results-california-proposition-50-redistricting,npr
1103,69336c07224715ec80b7394a07c929f8,prop 50,left,What to know about California's Proposition 50 redistricting measure and the Nov. 4 special election,REDACTED,https://www.cbsnews.com/sacramento/news/california-proposition-50-explainer/,cbsnews
1104,b92a1ca9fc7ae3a298396d81821992b1,prop 50,right,"Everything you need to know about Election Day 2025: Critical elections, ballot measures and more",REDACTED,https://www.foxnews.com/politics/everything-you-need-to-know-about-election-day-2025-critical-elections-ballot-measures-and-more,foxnews
1105,b01307d449fa441a2e08e976ce234c9f,prop 50,right,Ballot Initiative Aims to Bar California Lawmakers Who Support Prop. 50 From Seeking Public Office,REDACTED,https://www.theepochtimes.com/us/ballot-initiative-aims-to-bar-california-lawmakers-who-support-prop-50-from-seeking-public-office-5937689,theepochtimes
1106,04d074ec71ae72229941c827282da08f,prop 50,right,Republicans fight Newsom's $88M redistricting 'power grab' as Prop 50 battle heats up,REDACTED,https://www.foxnews.com/politics/republicans-fight-newsoms-88m-redistricting-power-grab-prop-50-battle-heats-up,foxnews
1107,54e6aebc927a1fff5be75d80a6b2bed2,prop 50,right,DOJ sues over California US House map that could tip control of Congress: ‘Brazen power grab’,REDACTED,https://nypost.com/2025/11/13/us-news/doj-sues-over-california-us-house-map-that-could-tip-control-of-congress/,nypost
1108,91a4c79b405faa3c3c0f0d19ee17bb2b,prop 50,right,California Republicans wiped out by Prop 50 blast redistricting coup,REDACTED,https://nypost.com/2025/11/05/us-news/california-republicans-wiped-out-by-prop-50-blast-redistricting-coup/,nypost
1109,17d6dbb98f42d910ec2761380155ad00,prop 50,right,California's high-stakes redistricting fight raises $215 million,REDACTED,https://www.washingtonexaminer.com/news/campaigns/state/3839332/california-redistricting-fight-raises-215-million/,washingtonexaminer
1110,5a92a519dd22b57695babab237d71fbb,prop 50,right,Gavin Newsom’s Texas ‘victory lap’ breaks faith with Californians he’s left behind,REDACTED,https://nypost.com/2025/11/10/opinion/gavin-newsoms-texas-victory-lap-breaks-faith-with-the-californians-left-behind/,nypost
1111,63e38a8470a841efd0901d3c7e05afa8,prop 50,right,Your guide to key ballot measures being voted on in California and New York City on Tuesday,REDACTED,https://www.foxnews.com/politics/your-guide-to-key-ballot-measures-being-voted-on-in-california-and-new-york-city-on-tuesday,foxnews
1112,382e0e280d92ec1bd254afd4602e5700,prop 50,right,5 key races to watch on Election Day 2025,REDACTED,https://www.foxnews.com/politics/five-key-races-watch-election-day-2025,foxnews
1113,2f65d29118c62b6d186adc7f07a6de1c,prop 50,right,"California's Proposition 50 passes, delivering major political win for Newsom",REDACTED,https://www.washingtonexaminer.com/news/3871493/california-proposition-50-redistricting-result/,washingtonexaminer
1114,947e441e415536e281569f761271492e,prop 50,right,EXCLUSIVE: Calif. Lawmaker Intends to Bring Lawsuit Against Prop 50 Map to Supreme Court,REDACTED,https://www.dailysignal.com/2026/01/18/exclusive-ca-lawmaker-intends-to-bring-lawsuit-against-prop-50-map-to-supreme-court/,dailysignal
1115,5012c08ba085ec225e9c45cd9bb4eb7d,prop 50,right,"California sheriff seizes 650,000 ballots in defiance of state officials over election count dispute",REDACTED,https://www.foxnews.com/politics/california-sheriff-seizes-650000-ballots-defiance-state-officials-over-election-count-dispute,foxnews
1116,83fbb09e9a98cc47c46c323eb5c934cb,prop 50,right,Soros drops massive donation into Newsom's redistricting effort to counter Trump: report,REDACTED,https://www.foxnews.com/politics/soros-drops-massive-donation-newsoms-redistricting-effort-counter-trump-report,foxnews
1117,3088d32e90fea9129009b18f12802493,prop 50,right,California farmers push back on Prop 50 as Democrats eye new House map,REDACTED,https://www.foxnews.com/politics/california-farmers-push-back-prop-50-democrats-eye-new-house-map,foxnews
1118,08b274f917b3379245ff38587cfe04fb,prop 50,right,Will the Supreme Court upend the Voting Rights Act?,REDACTED,https://thenationaldesk.com/news/americas-news-now/will-the-supreme-court-upend-the-voting-rights-act-election-gerrymandering-louisiana-redistricting-trump-texas-california-congress,thenationaldesk
1119,72e585c4c0e58595e2d916701d247159,prop 50,right,Proposition 50 sparks fierce campaigning ahead of pivotal vote,REDACTED,https://www.washingtonexaminer.com/news/campaigns/state/3870992/proposition-50-fierce-campaigning-pivotal-vote/,washingtonexaminer
1120,36892e3d9e8608d322fa4fdad87d5b4b,prop 50,right,Trump Says California Redistricting Proposition Votes Under Review,REDACTED,https://www.theepochtimes.com/us/trump-says-california-redistricting-proposition-votes-under-review-5939810,theepochtimes
1121,07e2bb08aa631db2f281d0f34e4c15a8,prop 50,right,Newsom set to rally Texas Dems with victory lap days after Prop 50 passes: 'California stepped up',REDACTED,https://www.foxnews.com/politics/newsom-set-rally-texas-dems-victory-lap-after-prop-50-passes,foxnews
1122,910c5dccc7966693553d337ee5dbdfac,prop 50,right,Gavin Newsom’s crude Prop 50 chest-thumping isn’t the win he thinks it is,REDACTED,https://nypost.com/2025/11/05/opinion/gavin-newsoms-crude-prop-50-chest-thumping-isnt-the-win-he-thinks-it-is/,nypost
1123,ba94546c25a78630cb1338d220e40f50,prop 50,right,General,REDACTED,https://subs.theepochtimes.com/template/show?tid=9b52e988-2c2d-4f6a-9c92-69faaf11c36a&sid=www.theepochtimes.com&v=22&ck=JTdCJTIyZXBvY2hfdXNlcl9pZCUyMiUzQSUyMiUyMiUyQyUyMmVwb2NoX3Nlc3Npb25pZCUyMiUzQSUyMiUyMiUyQyUyMmVwb2NoX3Rva2VuJTIyJTNBJTIyJTIyJTJDJTIyZXBvY2hfc3Vic2NyaWJlZCUyMiUzQSUyMiUyMiU3RA==&pl=https%3A%2F%2Fwww.theepochtimes.com%2Fus%2Fwhat-do-the-polls-say-about-elections-in-new-york-new-jersey-virginia-and-california-5939261&u=JTdCJTIyaW5mbyUyMiUzQSU3QiUyMmNsaWVudElkJTIyJTNBJTIyYjMxNGI0NmMtYzlhNS00NzQwLWIyMzktMTE1OGI4NmYyZmZlJTIyJTJDJTIyZXN0JTIyJTNBJTIyJTIyJTJDJTIyaWQlMjIlM0ElMjIlMjIlMkMlMjJuZXdJZCUyMiUzQTAlMkMlMjJlbWFpbCUyMiUzQSUyMiUyMiUyQyUyMnBpY3R1cmUlMjIlM0ElMjIlMjIlMkMlMjJuYW1lJTIyJTNBJTIyJTIyJTJDJTIyZmlyc3ROYW1lJTIyJTNBJTIyJTIyJTJDJTIybGFzdE5hbWUlMjIlM0ElMjIlMjIlMkMlMjJyZWdpc3RlckRhdGUlMjIlM0EwJTJDJTIyZGF5c1NpbmNlQ2FuY2VsJTIyJTNBMCUyQyUyMmRheXNTaW5jZVNpZ251cCUyMiUzQTAlMkMlMjJoYXNQYXVzZWRTdWJzY3JpcHRpb24lMjIlM0FmYWxzZSUyQyUyMmVtYWlsVmVyaWZpZWRTdGF0dXMlMjIlM0EwJTJDJTIyaXNFbWFpbFZlcmlmaWVkJTIyJTNBZmFsc2UlMkMlMjJ0b2tlbiUyMiUzQSUyMiUyMiU3RCUyQyUyMmdlbyUyMiUzQSU3QiUyMmNvdW50cnklMjIlM0ElMjJVUyUyMiUyQyUyMmNpdHklMjIlM0ElMjJDQSUyMiUyQyUyMnRpbWV6b25lJTIyJTNBJTIyQW1lcmljYSUyRkxvc19BbmdlbGVzJTIyJTJDJTIybGF0aXR1ZGUlMjIlM0EzNy44MDQzJTJDJTIybG9uZ2l0dWRlJTIyJTNBLTEyMi4yMTU2JTdEJTJDJTIyc3Vic2NyaXB0aW9ucyUyMiUzQSU1QiU1RCUyQyUyMmhpc3RvcmljU3Vic2NyaXB0aW9ucyUyMiUzQSU1QiU1RCUyQyUyMnBhdXNlZFN1YnNjcmlwdGlvbnMlMjIlM0ElNUIlNUQlMkMlMjJzdWJzY3JpcHRpb24lMjIlM0ElN0IlMjJzdWJzY3JpYmVkJTIyJTNBZmFsc2UlMkMlMjJyZWdpb25JZCUyMiUzQSUyMiUyMiUyQyUyMnN1YnNjcmlwdGlvblR5cGUlMjIlM0ElMjIlMjIlMkMlMjJwbGFuSWQlMjIlM0ElMjIlMjIlMkMlMjJleHBpcmF0aW9uJTIyJTNBMCU3RCU3RA==&tn=Organic%20RW&rs=1&variantName=Premium-0512-desktop&primary_category=nyc-1%3Bus-13%3Bny-politics-3886%3Bnor-cal-san-francisco-1003%3Bus-politics-7026%3Bso-cal-los-angeles-94901%3Bregional-news-130555%3Bstate-news-148698%3Bnew-jersey-186975%3Bvirginia-186980%3Bcalifornia-190327&articleTitle=What%20Do%20the%20Polls%20Say%20About%20Elections%20in%20New%20York%2C%20New%20Jersey%2C%20Virginia%2C%20and%20California%3F&articleThumb=https%3A%2F%2Fimg.theepochtimes.com%2Fassets%2Fuploads%2F2025%2F11%2F03%2Fid5939340-GettyImages-2244069115.jpg&disableTwitter=true,theepochtimes
