,article_id,event,slant,title,body,url,source
403,60e5f6b7cb0f43e673472e95e8162730,charlie_kirk,right,EXCLUSIVE: FBI Investigating Social Media Accounts That Appeared To Indicate Foreknowledge of Kirk Assassination,REDACTED,https://freebeacon.com/politics/exclusive-fbi-investigating-social-media-accounts-that-appeared-to-indicate-foreknowledge-of-kirk-assassination/,freebeacon
404,f76f4a90a4db71211065bc96b195f28a,charlie_kirk,right,University of Michigan Prof Bankrolled by Gates Foundation Celebrates Charlie Kirk’s Assassination,REDACTED,https://freebeacon.com/campus/university-of-michigan-prof-bankrolled-by-gates-foundation-celebrates-charlie-kirks-assassination/,freebeacon
405,2295a04a214514d4a0ed13e2e24d999e,charlie_kirk,right,Erika Kirk named head of Turning Point USA in wake of husband's assassination,REDACTED,https://thenationaldesk.com/news/americas-news-now/erika-kirk-named-new-chair-ceo-turning-point-usa-husband-assassination-charlie-tpusa-announcement,thenationaldesk
406,cf995f3b1416cc32c956f101660a3018,charlie_kirk,right,A prosecutor’s child witnessed Charlie Kirk’s assassination — can he take part in the case?,REDACTED,https://www.foxnews.com/us/prosecutors-child-witnessed-charlie-kirk-assassination-can-he-take-part-case,foxnews
407,2af85ac7d5d51d6089d9251a714c0c1d,charlie_kirk,right,Charlie Kirk assassination suspect evades manhunt as investigators recover rifle in wooded area,REDACTED,https://www.foxnews.com/us/charlie-kirk-assassination-suspect-evades-manhunt-investigators-analyze-security-footage,foxnews
408,0d45796497bdc96a10187b87490841a2,charlie_kirk,right,Roblox removes 100 violative experiences referencing Charlie Kirk following campus assassination,REDACTED,https://www.foxbusiness.com/fox-news-crime/roblox-removes-100-violative-experiences-referencing-charlie-kirk-following-campus-assassination,foxbusiness
409,79de7ed65ceef75feab2c589bb639bf6,charlie_kirk,right,Alleged Charlie Kirk assassin's defense team reveals who will be called to testify: court docs,REDACTED,https://www.foxnews.com/us/alleged-charlie-kirk-assassins-defense-team-reveals-who-will-called-testify-court-docs,foxnews
410,b583e7c4524a0f846118fece081469a7,charlie_kirk,right,VOTE: Should people lose their jobs for celebrating Charlie Kirk's assassination?,REDACTED,https://thenationaldesk.com/news/americas-news-now/vote-do-you-think-people-should-lose-their-jobs-for-celebrating-political-activist-charlie-kirk-assassination-utah-valley-university-termination-suspension-backlash,thenationaldesk
411,68ea276740c83e4bb1d1b85751cd2a18,charlie_kirk,right,Suspected Charlie Kirk assassin Tyler Robinson's defense team delays key decision before case can proceed,REDACTED,https://www.foxnews.com/us/what-will-be-tyler-robinsons-defense-strategy-experts-weigh-accused-charlie-kirk-assassin,foxnews
412,03a222cf4d042e5652cb10c7611e7b48,charlie_kirk,right,Fact Check Team: Assassination of Charlie Kirk highlights rise in political violence,REDACTED,https://thenationaldesk.com/news/fact-check-team/fact-check-team-assassination-of-charlie-kirk-highlights-rise-political-violence-gabby-giffords,thenationaldesk
413,e63fea6e0ab16da2aedf2f1d431bc9c8,charlie_kirk,right,"Charlie Kirk assassination: Timeline of Utah campus shooting details attack, manhunt for suspect",REDACTED,https://www.foxnews.com/us/charlie-kirk-assassination-timeline-utah-campus-shooting-details-attack-manhunt-suspect,foxnews
414,0c429487144b0caed6077d1ef7fed3a4,charlie_kirk,right,Charlie Kirk fatally shot at Utah Valley University during his American Comeback Tour,REDACTED,https://nypost.com/2025/09/10/us-news/charlie-kirk-possibly-targeted-in-shooting-at-utah-valley-university-event-during-his-american-comeback-tour/,nypost
415,3e0713037548967a8ab5668adb1651ba,charlie_kirk,right,Fact Check Team: Could Charlie Kirk's assassination spark a Christian evangelism surge?,REDACTED,https://thenationaldesk.com/news/fact-check-team/fact-check-team-could-charlie-kirks-assassination-spark-christian-evangelism-surge-erika-jesus-christ-pew,thenationaldesk
416,9e1755fc2a4791338748724cc0ab154f,charlie_kirk,right,Charlie Kirk assassination drives jump in Bible sales,REDACTED,https://www.foxbusiness.com/economy/charlie-kirk-assassination-drives-jump-bible-sales,foxbusiness
417,4c1614fd35d907c59f0c8b27015630c2,charlie_kirk,right,"Prosecutors hammer Charlie Kirk assassination suspect with ‘voluminous’ DNA, gun, text and rooftop evidence",REDACTED,https://www.foxnews.com/us/prosecutors-hammer-charlie-kirk-assassination-suspect-voluminous-dna-gun-text-rooftop-evidence,foxnews
418,d7475b83fce3889a2d4cead3adcb0a7c,charlie_kirk,right,Dispatch Politics Roundup: Will the Charlie Kirk Assassination Reshape American Politics?,REDACTED,https://thedispatch.com/newsletter/dispatch-politics/kirk-utah-turning-point/,thedispatch
419,03f851aa5bd39f93e119135faf0b6aeb,charlie_kirk,right,Tyler Robinson prosecutors say defense fueled viral misinformation in Charlie Kirk assassination case,REDACTED,https://www.foxnews.com/us/tyler-robinson-prosecutors-say-defense-fueled-viral-misinformation-charlie-kirk-assassination-case,foxnews
420,7d0301a7e299f27d26b2081f775f214b,charlie_kirk,right,Charlie Kirk assassination: Exclusive photos show path to campus rooftop weeks later as access scrutinized,REDACTED,https://www.foxnews.com/us/charlie-kirk-assassination-exclusive-photos-show-path-campus-rooftop-weeks-later-access-scrutinized,foxnews
421,4df5d00e25d9f33284512b7ec2abaa75,charlie_kirk,right,New photos released of person of interest in Charlie Kirk assassination,REDACTED,https://thenationaldesk.com/news/americas-news-now/dept-of-safety-releases-new-photos-of-person-of-interest-in-charlie-kirk-assassination,thenationaldesk
422,21ff3d63c000d7ec3b169690d17bef94,charlie_kirk,right,Charlie Kirk mourned by world leaders after shocking Utah assassination,REDACTED,https://www.foxnews.com/world/charlie-kirk-mourned-world-leaders-after-shocking-utah-assassination,foxnews
423,83f26db5af58a1bbbaf2d4fbd4411478,charlie_kirk,right,Turning Point USA returns to Utah for first time since Charlie Kirk assassination,REDACTED,https://www.foxnews.com/us/utah-gov-marks-turning-point-tpusa-returns-after-charlie-kirk-assassination,foxnews
424,f8a78374962eae770eabfae99d58b1cf,charlie_kirk,right,Inappropriate comments about Charlie Kirk assassination gets workers fired,REDACTED,https://www.foxbusiness.com/lifestyle/workers-who-mocked-charlie-kirk-death-fired-placed-leave,foxbusiness
425,d0a67a9695d3a3b2cf812a8fe98d8014,charlie_kirk,right,UCLA Places Race and Equity Director Who Celebrated Charlie Kirk Assassination on Leave,REDACTED,https://freebeacon.com/campus/ucla-places-race-and-equity-director-who-celebrated-charlie-kirk-assassination-on-leave/,freebeacon
426,9bc246c22eb71047b495c1a48c95b420,charlie_kirk,right,Pentagon announces 'zero tolerance' for military personnel mocking Charlie Kirk's assassination,REDACTED,https://www.foxnews.com/politics/pentagon-announces-zero-tolerance-military-personnel-mocking-charlie-kirks-assassination,foxnews
427,0d170f70336b884ae4ccf6028ced266d,charlie_kirk,right,FBI reward for info leading to arrest of Charlie Kirk's assassin boosted by private donations,REDACTED,https://www.foxbusiness.com/politics/fbi-reward-info-leading-arrest-charlie-kirks-assassin-boosted-private-donations,foxbusiness
428,769af9a7dbb5885faa41df7950623795,charlie_kirk,right,FBI investigating leftist groups for possible ties to Charlie Kirk’s assassination: source,REDACTED,https://www.foxnews.com/us/fbi-investigating-leftist-groups-possible-ties-charlie-kirks-assassination-source,foxnews
429,88d248ba606d3a7fcccc27f8c2139993,charlie_kirk,right,Prosecutors reveal what analysis of Charlie Kirk bullet and Tyler Robinson’s gun really found,REDACTED,https://nypost.com/2026/03/31/us-news/prosecutors-reveal-what-analysis-of-charlie-kirk-bullet-and-tyler-robinsons-gun-really-found/,nypost
430,3b5e77c76088caa24ff3fc7aa31d7075,charlie_kirk,right,Judge rules on motion to seal evidence in Charlie Kirk murder case,REDACTED,https://www.foxnews.com/us/man-charged-charlie-kirks-assassination-seeks-seal-evidence-from-public,foxnews
431,c15d46d888b54dc39eb19f5e49b2c23b,charlie_kirk,right,"Charlie Kirk’s social media platforms gain millions of followers, subscribers since assassination",REDACTED,https://www.foxbusiness.com/politics/charlie-kirks-social-media-platforms-gain-millions-followers-subscribers-since-assassination,foxbusiness
432,ad008166a785354c8024a0fea498f045,charlie_kirk,right,Threats and Threats and ‘Threats’,REDACTED,https://thedispatch.com/article/charlie-kirk-assassination-trump-populism/,thedispatch
433,d0b3077c1fd5cc4c94c512f93f14283b,charlie_kirk,right,The Murder of Charlie Kirk,REDACTED,https://americanmind.org/salvo/the-murder-of-charlie-kirk/,americanmind
434,91394e495bde6275afaa7809d177d53f,charlie_kirk,right,Suspect appears at initial hearing after charged in Charlie Kirk assassination,REDACTED,https://thenationaldesk.com/news/americas-news-now/suspect-in-assassination-of-political-activist-charlie-kirk-to-appear-in-court,thenationaldesk
435,25e6b137a8ac9ec2e1c608fdf0996578,charlie_kirk,right,Countering Domestic Terrorism and Organized Political Violence,REDACTED,https://www.whitehouse.gov/presidential-actions/2025/09/countering-domestic-terrorism-and-organized-political-violence/,whitehouse
436,82e6eedbc81bb864f972790832dfba31,foreign_intelligence,center,What is the Fisa law Trump wants extended and why are lawmakers resisting?,REDACTED,https://www.bbc.com/news/articles/ckge8zkr0d2o,bbc
437,f6206aeef3aed2f58f6f1521ee0ec39d,foreign_intelligence,center,Latest spy powers proposal doesn’t have warrant requirement demanded by critics,REDACTED,https://thehill.com/homenews/house/5845084-fisa-section-702-spy-powers-warrants-house-republicans/,thehill
438,4c7313a80b3a9563e91fb293685a9e1b,foreign_intelligence,center,"Sessions, Coats push for permanent renewal of controversial surveillance law",REDACTED,https://thehill.com/policy/national-security/350155-sessions-coats-push-for-permanent-702-renewal/,thehill
439,5b64e5fd96333accf6ad541f84aea9fe,foreign_intelligence,center,U.S. House backs extension of FISA surveillance law,REDACTED,https://www.reuters.com/article/world/us/us-house-backs-extension-of-fisa-surveillance-law-idUSKBN20Y3G8/,reuters
440,16222301e488dbd9ce24f1a53005afab,foreign_intelligence,center,House approves contentious FISA bill in bipartisan vote,REDACTED,https://thehill.com/homenews/house/4590351-fisa-702-house-approves/,thehill
441,9fc29e49c178cf216e05e736ce3e9679,foreign_intelligence,center,Trump’s backing of spy powers puts GOP’s FISA 702 critics in tough spot,REDACTED,https://thehill.com/homenews/house/5793790-trump-spy-powers-gop-fisa-702/,thehill
442,dca7c00bb5d7a0d5f9629e1d573af7f8,foreign_intelligence,center,Congress approves short-term extension of warrantless surveillance powers,REDACTED,https://thehill.com/policy/national-security/4360341-fisa-congress-approves-short-term-extension-warrantless-surveillance-powers/,thehill
443,0edb97fb6aebab94e10f6a1618a6928b,foreign_intelligence,center,Progressives say they’ll vote against warrantless spy power renewal,REDACTED,https://thehill.com/homenews/house/5792731-progressives-fisa-section-702/,thehill
444,fc3871be48e6ff2256e3dbb52d585b7c,foreign_intelligence,center,Trump support for warrantless spy powers leading to FISA flips on both sides of the aisle,REDACTED,https://thehill.com/homenews/administration/5805147-fisa-section-702-trump/,thehill
445,dc03fea643d687a71181d59b7b4dd2ac,foreign_intelligence,center,House eyes clean FISA reauthorization vote that will be tricky,REDACTED,https://thehill.com/homenews/house/5790605-fisa-section-702-reauthorization-house-gop/,thehill
446,fd2d4529372f00a00941efabbdc7851f,foreign_intelligence,center,Congress Extends Contentious Surveillance Power for Two Weeks After Compromise Fails,REDACTED,https://www.wsj.com/politics/policy/house-rejects-compromise-surveillance-bill-forcing-short-term-fisa-extension-fe7475b0,wsj
447,f826683bcaea4ad68a0bf7d71942739e,foreign_intelligence,center,Foreign Intelligence Surveillance Act Renewal,REDACTED,https://www.c-span.org/program/news-conference/foreign-intelligence-surveillance-act-renewal/488490,c-span
448,d20ee87df01983d1feefdc393737af9c,foreign_intelligence,center,Controversial Surveillance Law Up for Renewal (Again) in April,REDACTED,https://reason.com/2024/01/31/controversial-surveillance-law-up-for-renewal-again-in-april/,reason
449,cc727cf352e3c769571ba45b0a3a730a,foreign_intelligence,center,Congress passes 45-day extension of nation’s spy powers,REDACTED,https://thehill.com/homenews/senate/5857966-congress-reconsiders-surveillance-reforms/,thehill
450,aa7569ac01c98be85f61a1b2c3354ab7,foreign_intelligence,center,Trump tells Republicans he won’t extend surveillance law without FISA reforms,REDACTED,https://thehill.com/policy/national-security/485836-trump-tells-republicans-he-wont-extend-surveillance-law-without-fisa/,thehill
451,5000341a8e71d7fc2207baa1e68775e0,foreign_intelligence,center,Trump asks GOP to ‘unify’ ahead of vote on spy powers,REDACTED,https://thehill.com/homenews/house/5830880-trump-fisa-section-702-renewal/,thehill
452,519cea1ca12eb71a2e1f948a5b270d03,foreign_intelligence,center,US Congress punts on surveillance powers after failing to authorize a long-term extension,REDACTED,https://www.reuters.com/world/us-house-republicans-close-extending-surveillance-act-with-small-reforms-2026-04-17/,reuters
453,3724dc1e380b86f2032ae0683e3c4592,foreign_intelligence,center,Trump’s Spin on Democratic Memo,REDACTED,https://www.factcheck.org/2018/02/trumps-spin-democratic-memo/,factcheck
454,5abf18d4d16a32544f2b7d76ed803ca5,foreign_intelligence,center,Crypto fight at center of FISA extension poised to escalate,REDACTED,https://thehill.com/policy/technology/5859873-crypto-fight-at-center-of-fisa-extension-poised-to-escalate/,thehill
455,2755779560ddf456be690c38e5793bfa,foreign_intelligence,center,Thune pushes 45-day extension of FISA surveillance authority to avoid blackout,REDACTED,https://thehill.com/homenews/senate/5857352-thune-fisa-702-extension/,thehill
456,b430075fb2ed54745262ab6aa1e14a58,foreign_intelligence,center,Republicans float short-term spy powers extension as they struggle to strike deal,REDACTED,https://thehill.com/homenews/house/5834182-spy-powers-short-term-extension-gop-leaders/,thehill
457,9b141827c9af9129c202b4bea40b69eb,foreign_intelligence,center,Senate approves extension of FISA surveillance just after deadline,REDACTED,https://thehill.com/homenews/senate/4607125-fisa-surveillance-section-702-passes/,thehill
458,72353c1c7de92a5f1d528172325f0ea8,foreign_intelligence,center,Trump makes public call for clean 18-month FISA 702 extension,REDACTED,https://thehill.com/homenews/administration/5800566-donald-trump-fisa-702-extension-support/,thehill
459,f5d88bd8c364c5b07fc09b9fd1a8e66d,foreign_intelligence,center,Jeffries says he’s ‘deeply skeptical’ of FISA extension without new privacy protections,REDACTED,https://thehill.com/homenews/house/5835525-jeffries-skeptical-fisa-extension/,thehill
460,aa0f20c118a5e3321c0eec239c996dd5,foreign_intelligence,center,House GOP passes short-term FISA deal amid Republican infighting,REDACTED,https://thehill.com/homenews/house/5835879-fisa-702-spy-powers-vote/,thehill
461,246591c891e51b74eda3a01604423117,foreign_intelligence,center,Trump signs renewal of surveillance powers amid uproar over memo,REDACTED,https://thehill.com/policy/national-security/369813-trump-signs-renewal-of-surveillance-powers-amid-uproar-over-memo/,thehill
462,9bc11b2ab2708a89e07c4ff7786434bc,foreign_intelligence,center,House unveils new warrantless surveillance bill,REDACTED,https://thehill.com/policy/national-security/4463961-house-unveils-warrantless-surveillance-bill/,thehill
463,e715fabd7ccf4cde3dc46520d604c93e,foreign_intelligence,center,Senate Republicans furious over Trump trying to derail FISA bill,REDACTED,https://thehill.com/homenews/senate/4589449-senate-republicans-furious-over-trump-derailing-fisa-bill/,thehill
464,2f35f9e620ee8fc74090ecab292b2afe,foreign_intelligence,center,Live updates: Leavitt says US has not requested longer ceasefire; House takes up FISA renewal,REDACTED,https://thehill.com/homenews/administration/5830846-live-updates-trump-iran-fed-fisa/,thehill
465,c6aa4be8f47d63339c96451a64b3067e,foreign_intelligence,center,Senate passes 10-day extension of nation’s spy powers,REDACTED,https://thehill.com/homenews/senate/5836438-senate-advances-10-day-fisa-extension/,thehill
466,c17e135fdbc453748474fe078ff701ca,foreign_intelligence,center,Lawmakers Try To Insert Privacy Protections Into the Feds' Snooping Powers,REDACTED,https://reason.com/2023/11/07/lawmakers-try-to-insert-privacy-protections-into-the-feds-snooping-powers/,reason
467,500db7b69da8c9088f29c9bb98dfe39d,foreign_intelligence,center,House gears up for tough vote on spy powers,REDACTED,https://thehill.com/homenews/house/5831739-fisa-section-702-spy-powers-vote-house/,thehill
468,c96b6af0f0218324f48581067467a4d8,foreign_intelligence,center,Why the surveillance powers in FISA roil Congress – across party lines,REDACTED,https://www.csmonitor.com/USA/Politics/2026/0417/fisa-congress-surveillance-privacy-security,csmonitor
469,4a1688a9a18eb2e7a4ce2c0a5a5d83ac,foreign_intelligence,center,Negotiators hopeful for deal on spy powers amid messy battle over reforms,REDACTED,https://thehill.com/homenews/house/5843782-fisa-702-spy-powers-negotiations/,thehill
470,e09862985d0b2e4d0fc48ed59e79aa42,foreign_intelligence,center,Congress Still Has a Chance To Curb Section 702 Surveillance Abuses,REDACTED,https://reason.com/2026/04/24/congress-still-has-a-chance-to-curb-section-702-surveillance-abuses/,reason
471,b6f982167eb0b89acb60c04b102cd417,foreign_intelligence,center,Marjorie Taylor Greene Slams ‘New MAGA’ Over FISA,REDACTED,https://www.newsweek.com/marjorie-taylor-greene-slams-new-maga-over-fisa-11834685,newsweek
472,a345560aa4f056539758831623a53527,foreign_intelligence,center,FISA renewal’s long and winding road to passage in the House,REDACTED,https://thehill.com/opinion/congress-blog/4601419-fisa-renewals-long-and-winding-road-to-passage-in-the-house/,thehill
473,ee43202c97560a9469816d4f71f2b493,foreign_intelligence,center,Trump support for warrantless spy powers could jeopardize Democratic backing,REDACTED,https://thehill.com/policy/national-security/5779649-trump-fisa-702-warrantless-spy-powers-democrats/,thehill
474,bbfbe105291975dcfdf8672fbc68e70a,foreign_intelligence,center,Looming deadline to extend warrantless surveillance powers sparks congressional scramble,REDACTED,https://thehill.com/homenews/house/4336110-looming-deadline-to-extend-warrantless-surveillance-powers-sparks-congressional-scramble/,thehill
475,001a7f6d45865f5bab240ddda5cf0816,foreign_intelligence,center,Johnson faces tough road when bills that split GOP return to House,REDACTED,https://www.newsnationnow.com/politics/johnson-faces-tough-road-when-bills-that-split-gop-return-to-house/,newsnationnow
476,d71fc81f8f5ffc5353eaa9e2199e3914,foreign_intelligence,center,Rick Scott calls for ‘commonsense’ reforms to FISA,REDACTED,https://thehill.com/homenews/senate/5838650-rick-scott-fisa-reforms/,thehill
477,5feaabf2ad9e8f44fa5753d9d24ebd62,foreign_intelligence,center,House passes bill to extend controversial surveillance program,REDACTED,https://san.com/cc/house-passes-bill-to-extend-controversial-surveillance-program/,straight arrow news
478,1721b97703865bee505bc751f1c54016,foreign_intelligence,center,Trump warns Iran after US ships transit Strait of Hormuz under fire,REDACTED,https://thehill.com/homenews/administration/5868920-trump-warns-iran-violence/,thehill
479,404a7f828db82cd6c79ee52e7efc361b,foreign_intelligence,center,Full List of Republican Rebels Who Voted Against FISA Extension,REDACTED,https://www.newsweek.com/full-list-of-republican-rebels-who-voted-against-fisa-extension-11843397,newsweek
480,0737dc83208659b2a43b03bc67fb0bce,foreign_intelligence,center,"Data Privacy And The Contested Extension Of FISA, Section 702",REDACTED,https://www.forbes.com/sites/hessiejones/2024/04/23/government-overreach-the-threat-to-civil-liberties-the-contested-extension-of-fisa-section-702/,forbes
481,2264077f10646c0c709529e563cac841,foreign_intelligence,center,House intel mulls ‘Plan B’ of short-term 702 renewal amid looming FISA deadline,REDACTED,https://thehill.com/policy/national-security/4290025-house-intel-mulls-plan-b-of-short-term-702-renewal-amid-looming-fisa-deadline/,thehill
482,b85a34b3ca22b9faf321e305d62b91f5,foreign_intelligence,center,"Jim Jordan reverses long-held position on spy powers, says he will back Trump extension of FISA 702",REDACTED,https://thehill.com/homenews/house/5789874-jim-jordan-fisa-702-spy-powers/,thehill
483,38a7b958407b7c9117b0005dff73755d,foreign_intelligence,left,Senate extends controversial surveillance program used by U.S. spy agencies,REDACTED,https://www.pbs.org/newshour/politics/senate-extends-controversial-surveillance-program-used-by-u-s-spy-agencies,pbs
484,630ec2158540d6f2c61a4bb568ce49b4,foreign_intelligence,left,"After 2 failed votes, Mike Johnson unveils new plan to extend key U.S. spy powers",REDACTED,https://www.npr.org/2026/04/24/nx-s1-5797964/after-2-failed-votes-mike-johnson-unveils-new-plan-to-extend-key-u-s-spy-powers,npr
485,639589e8fb4a25ad457c7a5b1802ba3b,foreign_intelligence,left,House votes to renew foreign spy program and creates pathway to end DHS shutdown,REDACTED,https://www.nbcnews.com/politics/congress/house-fisa-spy-program-budget-resolution-dhs-shutdown-ice-farm-bill-rcna342730,nbcnews
486,55a85b388c89d662faff5e49d36d577f,foreign_intelligence,left,Trump urges extending FISA program as some lawmakers push for privacy protections for Americans,REDACTED,https://www.pbs.org/newshour/politics/trump-urges-extending-fisa-program-as-some-lawmakers-push-for-privacy-protections-for-americans,pbs
487,ad6a112e86eb65602adbb122a8254888,foreign_intelligence,left,Trump summons FISA holdouts to the White House,REDACTED,https://www.politico.com/news/2026/04/14/trump-summons-fisa-holdouts-white-house-00871922,politico
488,0f2c25ed43d82486a79d168ea6c2ebef,foreign_intelligence,left,'If You Can Keep It': The Future Of The Foreign Intelligence Surveillance Act,REDACTED,https://www.npr.org/2026/04/20/nx-s1-5791769/if-you-can-keep-it-the-future-of-the-foreign-intelligence-surveillance-act,npr
489,d1ee52a7125dac672ff725320c8b4738,foreign_intelligence,left,Congress approves 10-day extension for warrantless surveillance law,REDACTED,https://www.washingtonpost.com/national-security/2026/04/17/fisa-warrantless-surveillance/,washingtonpost
490,ec07b008ea6d96c61aec678c6501c3d8,foreign_intelligence,left,House passes three,REDACTED,https://www.politico.com/live-updates/2026/04/29/congress/section-702-passes-house-00899071,politico
491,6c149c86d43c87a33c655fc6dfa4fcd8,foreign_intelligence,left,What is the FISA court?,REDACTED,https://time.com/article/2026/04/27/fisa-fbi-spying-surveillance-fisa-court-congress-wyden/,time
492,3d5532407dd39b903ba15dfca44389ef,foreign_intelligence,left,House passes FISA extension ahead of Thursday deadline,REDACTED,https://www.cbsnews.com/news/renewal-fisa-section-702-surveillance-program-house-vote-thursday-deadline/,cbsnews
493,d966e179584e429289112e751482a81a,foreign_intelligence,left,Trump signs short-term FISA extension; surveillance law will be maintained through April 30,REDACTED,https://www.cbsnews.com/news/senate-passes-short-term-fisa-extension-after-house-does/,cbsnews
494,0697b3f207282f2fcf55f31ba980ad0c,foreign_intelligence,left,"With no deal on reforms, Congress passes stopgap plan for controversial spy tool",REDACTED,https://www.npr.org/2026/04/29/g-s1-119094/congress-fisa-702,npr
495,21d6c7520d6a5dad4a2018069d107b60,foreign_intelligence,left,Trump signs surveillance extension into law,REDACTED,https://www.politico.com/story/2018/01/19/trump-surveillance-extension-351136,politico
496,87172be68a5c0f50e6b076049ab8ea8f,foreign_intelligence,left,Johnson pursues a ‘modified’ FISA extension,REDACTED,https://www.politico.com/live-updates/2026/04/16/congress/leaders-rushing-to-land-fisa-deal-00876916,politico
497,9ad6ce6eb030ac73599c0130764967dc,foreign_intelligence,left,Mike Johnson faces FISA mayhem,REDACTED,https://www.politico.com/live-updates/2026/04/14/congress/mike-johnson-faces-fisa-mayhem-00872465,politico
498,88a99f62c5947639b04b57c89fddd1e4,foreign_intelligence,left,White House wants a reprieve in spy-powers fight that is splitting the GOP,REDACTED,https://www.politico.com/news/2026/02/18/trump-section-702-clean-extension-00787007,politico
499,28faeec29ab15726d7a9e9d77140ac65,foreign_intelligence,left,News Wrap: Senate approves short-term renewal of FISA surveillance program,REDACTED,https://www.pbs.org/newshour/show/news-wrap-senate-approves-short-term-renewal-of-fisa-surveillance-programnews-wrap-48,pbs
500,757ff6dda409d4b63e66b023f6a67f6e,foreign_intelligence,left,"Senate votes to extend key FISA provision, sending bill to Trump's desk",REDACTED,https://www.cbsnews.com/news/senate-votes-to-extend-fisa-sending-bill-to-trumps-desk/,cbsnews
501,c749880c1a79e8d1dc04b13acdc45706,foreign_intelligence,left,Senators move to rein in foreign surveillance power,REDACTED,https://www.politico.com/live-updates/2026/02/23/congress/senators-move-to-rein-in-foreign-surveillance-power-00793924,politico
502,1ee776470efa86548adb09a0056be754,foreign_intelligence,left,US Congress passes 10-day extension of surveillance law amid Republican infighting,REDACTED,https://www.theguardian.com/us-news/2026/apr/17/congress-fisa-extension-warrantless-surveillance-law,theguardian
